{"assurance":"operator_asserted_pre_outcome_binding_not_independent_or_timestamped","evaluator":{"case_count":448,"ciphertext_link_status":"in_process_gpg_decryption_then_inner_signature_verification","class_counts":{"adversarial":112,"benign":336},"gpg_closure_digest":"sha256:87eb42a2bdd3e709670b4e8159139fff7c9d256d09581ff02d54adf6257ac045","gpg_passphrase_cache":"disabled_with_no_symkey_cache_and_private_homedir","label_ledger_digest":"sha256:5c91fec390d8b4043f80d26091b858b63416d32e1963682f15cab5494add3ecb","label_ledger_digest_rule":"raw_sha256_of_signature_verified_canonical_jsonl_bytes","label_ledger_signature_status":"verified","manifest_digest":"sha256:c41f3ff2dddf38e1bafe16bacc599578a8327661530f55ba174afb3129d50951","manifest_signature_status":"verified","public_manifest_digest":"sha256:72105d56773353634d56d74029757dc027780bc00f13781f74c3adaa7c94562d"},"limitations":{"authorship":"technical_codex_authorship_not_independent_human_identity","custody":"software_signatures_operator_uid_trusted_not_same_uid_or_hardware_attested","ordering":"signed_commit_ordering_must_be_verified_before_dispatch"},"lock":{"canonical_json":true,"lock_digest":"sha256:7f05171db56b35f8f76053222a6806228711679d4a5562b0b7328417fae549c7","semantic_preflight":"passed"},"pre_outcome":{"dispatch_material_observed":false,"evidence_status":"operator_observed_paths_absent_not_timestamp_attested","labels_exposed_to_worker":false,"outcomes_observed":false,"paths_checked_absent":4,"state_binding_digest":"sha256:c8957dc21e2ace612ce9686e526dad17db6974f8970e16978568754118f8d53f","state_layout":"phase0-hidden-run-state/v1"},"recorded_on":"2026-07-24","release":{"evaluator_ciphertext_digest":"sha256:51d2c19922a9a75347457dff1a782ff26002b61815b56bdf9b7fa56d7e4cf840","fingerprint":"SHA256:ZEvALtqmkjf1dRDeiSmgl9Og/n+AEUMEypoMFezoWAo","freeze_commit":"5ff11440d544a09c1e35e7938368cb0fde428b48","freeze_tag":"independent-corpus-v1.0.0","freeze_tag_object":"f56e0e695321a647dfffb6168b8bd1d57a78e12f","principal":"codex-independent-corpus@local.invalid","release_manifest_digest":"sha256:8d5b985384ee6f1cef63a8ba97fddcfb89012d9cd5ab2d6c5749c69abbf53449","signature_status":"verified","source_bundle_digest":"sha256:b2c7dfbca5533721a1f5c4840b87cf5c1d2a4a08bd491bf200ee4c7d89aa5247","worker_archive_digest":"sha256:f7cc194a95775afdaaddd09ab98dbaba131c28c9f0ba72c425f43532e965465f"},"schema":"aragorn/benchmark-phase0-hidden-suite-freeze-receipt/v1","suite":{"candidate_policy_digest":"sha256:80b760cd54e0470b11d8c030ca9ce2e438eeb515f5dfe4d29b0d21a7d40f87f0","case_count":448,"class_counts":{"adversarial":112,"benign":336},"private_suite_retained_outside_repository":true,"runs_per_case":1,"split":"hidden","suite_digest":"sha256:5307d67bef0d074d600b6eae2a7e935f657dccc691927e5b9a2a05b0b4afbc5c","systems":[{"config_digest":"sha256:80b760cd54e0470b11d8c030ca9ce2e438eeb515f5dfe4d29b0d21a7d40f87f0","implementation_digest":"sha256:becf8c0ea320eac74658c3befee45d1629bc6b7d3a87b80764f2543bf94fac85","name":"aragorn","version":"0.1.0-phase0"},{"config_digest":"sha256:1bd32d308ef4341513ce023a026f163e3476b6dbb8f0fe0692688643ef5b272c","implementation_digest":"sha256:7fadcfbe836eef9490feba0fadd2ada564c11eb541077e3efee5f61edbd2e65c","name":"cisco-skill-scanner","version":"2.0.12"},{"config_digest":"sha256:3ea219f45c1b65bff7b521e76d0b38a6b3a2aee6d260d04f60613e3ee4a7f7ec","implementation_digest":"sha256:e731be01105243f94437a4b9bd449bd46bbcb5cb306f44b4845121d109a4a95e","name":"skillspector","version":"2.4.3+git.a54947c"}]}}